{"format":"deka.artifact@2","origin":"authored","producer":{"deka":"0.47.0","dsc":"dsc [version 0.9.0]","plan_version":2},"compat":{"runtime_abi":1,"module_format":"esm2022","targets":["native","worker"],"host_imports":[]},"client":{"root":"client","index":"client/index.html","trailing_slash":false},"server":{"root":"server","entries":[{"id":"not_found:/","kind":"not_found","module":"server/app/not-found.js","export":"default","methods":[]},{"id":"page:/","kind":"page","module":"server/app/page.js","export":"default","methods":[]},{"id":"page:/posts/[slug]","kind":"page","module":"server/app/posts/[slug]/page.js","export":"default","methods":[]}]},"routes":[{"template":"/","mode":"static","outputs":["client/index.html"],"entry":null,"source_file":"app/page.dsx"},{"template":"/posts/[slug]","mode":"static_params","instances":["/posts/hello","/posts/world"],"outputs":["client/posts/hello/index.html","client/posts/world/index.html"],"entry":null,"slot":"104b1b1b321f9256","source_file":"app/posts/[slug]/page.dsx"}],"slots":[{"id":"104b1b1b321f9256","binding":"staticParams","file":"app/posts/[slug]/page.dsx","descriptor_digest":"sha256:c8fb2c808980573e3b1ec1598fdc2ba7f4328ba53152cf2a53e3ff0a18e12dc3","module":"server/.values/104b1b1b321f9256.js","observations":[]}],"payloads":[{"path":"_redirects","role":"client","bytes":84,"digest":"sha256:a0ecc16dbc03f184986082f89e7e1257ccfea5feed98c2ef0c641029c8f0898d"},{"path":"client/_redirects","role":"client","bytes":84,"digest":"sha256:a0ecc16dbc03f184986082f89e7e1257ccfea5feed98c2ef0c641029c8f0898d"},{"path":"client/index.html","role":"client","bytes":488,"digest":"sha256:5808cf90ceec7a0d9e01b1ed8fc20fc1103cccfdca3fabbde3fedb68653b38fa"},{"path":"client/posts/hello/index.html","role":"client","bytes":427,"digest":"sha256:26bf9fafb2e3ee65f5fbbd1ed0a62e27ba6c913f10469ebd0830a547048a40e5"},{"path":"client/posts/world/index.html","role":"client","bytes":427,"digest":"sha256:5a855ed54dfbdf21475dd1cb0515e9d5a5cdb7013aa9fefeee56b91c1ca445d5"},{"path":"client/style.css","role":"client","bytes":59,"digest":"sha256:2962b955b6555f16d7c88fb953cd750aa33acd50d57e528478970e3b531ad0cb"},{"path":"server/.ui/island-marker.js","role":"server","bytes":7898,"digest":"sha256:811fdfe83df9c69580aac3a9a9cd09731919cc69ba44f4dd3193cd079fdea482"},{"path":"server/.ui/jsx.js","role":"server","bytes":9723,"digest":"sha256:91a1195be017e4814d5a4b4bcfe5950683b22bbda77e49db406dd4deda17ee0b"},{"path":"server/.ui/reactive.js","role":"server","bytes":1606,"digest":"sha256:e9c4037e5b9e668fbe5c684f9fa1f121c5a326a69ae48f394b41b6ce17ea429b"},{"path":"server/.ui/router.js","role":"server","bytes":7326,"digest":"sha256:597d7c2a26b22d4a185f53e530cd5ed0cb7acb2eafc4c5b73ddc4fe11684b9bb"},{"path":"server/.ui/server.js","role":"server","bytes":26046,"digest":"sha256:08cedfd6f41ae21723ddc30c96de740668bd0bc7c6f2d6bd0959ff6a744dc63b"},{"path":"server/.ui/suspense.js","role":"server","bytes":1127,"digest":"sha256:fe3f568ad2dc3e7d583c4fa0f14dc6b7d2ba659d4e60d0db3aa91318e70ded5b"},{"path":"server/.values/104b1b1b321f9256.js","role":"server","bytes":3160,"digest":"sha256:20d764fac3e9a57150f7a431cd7901dc643ef3ef945e18099f8989a98a24302e"},{"path":"server/app/layout.js","role":"server","bytes":300,"digest":"sha256:cd92a9ab53229a3fd27eaaccb09ddd09034b87db1388cd0a5b674ef9cf9848ce"},{"path":"server/app/not-found.js","role":"server","bytes":275,"digest":"sha256:afa1808a933d490b429922064d542013d403ffe60a950ec48f47f10bdbd5e0f3"},{"path":"server/app/page.js","role":"server","bytes":338,"digest":"sha256:ebfcd8715828fc142906b1568d550c68b0d286878ed4564d5a88249111e8618e"},{"path":"server/app/posts/[slug]/page.js","role":"server","bytes":874,"digest":"sha256:a92d153e58ed2a87a130c88fc0ff4b876e2c0985e5e7539fee7c63c9a3ceb244"},{"path":"server/deka.json","role":"server","bytes":193,"digest":"sha256:857d5a18a4d4a183e6a08bb935cb366af692414d2dafce4ac023181a364d6c46"},{"path":"server/deka.lock","role":"server","bytes":45,"digest":"sha256:8e0735705d18daa7c3e11b8ce88843f13f823c5612688fb1456562af56f9323d"},{"path":"server/serve-entry.js","role":"server","bytes":5464,"digest":"sha256:577ef1ffe19ffb27ebd13f89726defbfd17f8db03845ea966c83c3704cf7ab80"}],"payload_root":"sha256:5abdf4fb0ef6d294a5a3a85220760417cdd0f4f8d07aac07bb303873bf03b6a4"}
