{"format":"deka.artifact@2","origin":"authored","producer":{"deka":"<workspace-version>","dsc":"dsc [version 0.9.0]","plan_version":2},"compat":{"runtime_abi":1,"module_format":"esm2022","targets":["native","worker"],"host_imports":[]},"client":{"root":"client","index":"client/index.html","trailing_slash":false},"server":{"root":"server","entries":[{"id":"not_found:/","kind":"not_found","module":"server/app/not-found.js","export":"default","methods":[]},{"id":"page:/","kind":"page","module":"server/app/page.js","export":"default","methods":[]},{"id":"page:/user/[id]","kind":"page","module":"server/app/user/[id]/page.js","export":"default","methods":[]}]},"routes":[{"template":"/","mode":"static","outputs":["client/index.html"],"entry":null,"source_file":"app/page.dsx"},{"template":"/user/[id]","mode":"request_time","outputs":[],"entry":"page:/user/[id]","source_file":"app/user/[id]/page.dsx"}],"slots":[],"payloads":[{"path":"_redirects","role":"client","bytes":84,"digest":"sha256:a0ecc16dbc03f184986082f89e7e1257ccfea5feed98c2ef0c641029c8f0898d"},{"path":"client/_redirects","role":"client","bytes":84,"digest":"sha256:a0ecc16dbc03f184986082f89e7e1257ccfea5feed98c2ef0c641029c8f0898d"},{"path":"client/index.html","role":"client","bytes":488,"digest":"sha256:5808cf90ceec7a0d9e01b1ed8fc20fc1103cccfdca3fabbde3fedb68653b38fa"},{"path":"client/style.css","role":"client","bytes":59,"digest":"sha256:2962b955b6555f16d7c88fb953cd750aa33acd50d57e528478970e3b531ad0cb"},{"path":"server/.ui/island-marker.js","role":"server","bytes":7898,"digest":"sha256:811fdfe83df9c69580aac3a9a9cd09731919cc69ba44f4dd3193cd079fdea482"},{"path":"server/.ui/jsx.js","role":"server","bytes":9723,"digest":"sha256:91a1195be017e4814d5a4b4bcfe5950683b22bbda77e49db406dd4deda17ee0b"},{"path":"server/.ui/reactive.js","role":"server","bytes":1606,"digest":"sha256:e9c4037e5b9e668fbe5c684f9fa1f121c5a326a69ae48f394b41b6ce17ea429b"},{"path":"server/.ui/router.js","role":"server","bytes":7326,"digest":"sha256:597d7c2a26b22d4a185f53e530cd5ed0cb7acb2eafc4c5b73ddc4fe11684b9bb"},{"path":"server/.ui/server.js","role":"server","bytes":26046,"digest":"sha256:08cedfd6f41ae21723ddc30c96de740668bd0bc7c6f2d6bd0959ff6a744dc63b"},{"path":"server/.ui/suspense.js","role":"server","bytes":1127,"digest":"sha256:fe3f568ad2dc3e7d583c4fa0f14dc6b7d2ba659d4e60d0db3aa91318e70ded5b"},{"path":"server/app/layout.js","role":"server","bytes":300,"digest":"sha256:cd92a9ab53229a3fd27eaaccb09ddd09034b87db1388cd0a5b674ef9cf9848ce"},{"path":"server/app/not-found.js","role":"server","bytes":275,"digest":"sha256:afa1808a933d490b429922064d542013d403ffe60a950ec48f47f10bdbd5e0f3"},{"path":"server/app/page.js","role":"server","bytes":338,"digest":"sha256:ebfcd8715828fc142906b1568d550c68b0d286878ed4564d5a88249111e8618e"},{"path":"server/app/user/[id]/page.js","role":"server","bytes":303,"digest":"sha256:839b048747cd06658ecfbd11003520013dbfb877368f652e10e5163dca3702b3"},{"path":"server/deka.json","role":"server","bytes":192,"digest":"sha256:e69dc5badf1d7c31d71d98aba2528c6d6de05d35f09fa5a9d7aa026546df700a"},{"path":"server/deka.lock","role":"server","bytes":45,"digest":"sha256:8e0735705d18daa7c3e11b8ce88843f13f823c5612688fb1456562af56f9323d"},{"path":"server/serve-entry.js","role":"server","bytes":5452,"digest":"sha256:f247499b7f1cd370636b87b36ac2fd9e2afa893874769c0b68b890a048f3e759"}],"payload_root":"sha256:e014ca147baf16c7d42d33a6d8e2c200c5128dadfd2853002e297e59539383ed"}
